{
  "id": "FACTORY-ALIGN-002",
  "title": "Prompts and Telemetry Phase Alignment",
  "status": "In Review",
  "created_at": "2026-05-05T12:00:00Z",
  "updated_at": "2026-05-05T12:30:00Z",
  "assigned_to": "gemini-cli",
  "phase": "foundations",
  "token_usage": {
    "total": 0,
    "prompt": 0,
    "completion": 0
  },
  "spec_path": "prompts/foundations/02_20260505_prompts_telemetry.md",
  "dependencies": [
    "FACTORY-ALIGN-001"
  ],
  "metadata_version": "1.1"
}
